{
  "id": "fire_apartment_smoke.correct",
  "title": "Пожар: оператор записал адрес верно",
  "operator_scenario_id": "fire_apartment_smoke",
  "level": 1,
  "elapsed_s": 90,
  "card": {
    "incident_type_code": "1050102",
    "tags": [
      "victims",
      "gasification"
    ],
    "services": [
      "101",
      "102",
      "103",
      "104",
      "MOSLIFT"
    ],
    "address": {
      "city": "Москва",
      "okrug": "САО",
      "district": "Западное Дегунино",
      "street": "Дубнинская улица",
      "house": "12",
      "building": "",
      "apartment": "47",
      "object": "",
      "structure": "",
      "entrance": "2",
      "floor": "5",
      "code": "",
      "descriptive": "Напротив дома продуктовый магазин, через дорогу школа"
    },
    "description": "Задымление в квартире 47 на пятом этаже дома 12 по Дубнинской улице: из-под двери идёт густой дым, открытого огня заявитель не видит; в квартире пожилая соседка, не выходит на стук, квартира заперта изнутри, подъезд открыт.",
    "caller_name": "Соснина Ольга",
    "caller_status": "очевидец",
    "phone_provided": "+79161234567",
    "phone_scene": "+79161234567",
    "off_site": false,
    "emergency": false
  },
  "teacher_note": "Карточка соответствует словам заявителя."
}
